user_id,review_id,text,date,stars,useful,funny,target,sentiment_score,rule1_threshold,rule5_threshold,rule2_threshold,rule4_threshold,similarity_score,rule6_threshold,rule3_threshold
MGPQVLsODMm9ZtYQW-g_OA,l0Q8oR1jLrAMakbrto-2Vw,"Modesto is my hands-down favorite restaurant in St. Louis. It's a warmly hip, high-spirited eatery that is a far cry from the typical Italian sleepers that have long defined ""The Hill"".  It's somewhere you can go for a big girls night or conversely, come for a catch-up dinner with friends you haven't seen in years. Every year since they opened in 2001, I meet my high-school best friend and her husband as they visit from Boston over the holidays. One year I made the mistake of 'changing it up' by selecting a Pan-Asian restaurant and I deservedly heard about my error until the next year. Never again.\n\nI live for tapas and sangria, so it's no surprise that I try the most highly-recommended Spanish restaurant in any city I visit or have lived in. From NYC to DC, to Miami to L.A., to Boston to Chicago, I have not tried a better sangria than Modesto's. It's authentically-crafted with Brandy and simmered with sugar before cooling. It's pricey at $24/pitcher, but worth the praise you'll receive for suggesting it as well as the laughs that will soon ensue.\n\nYou really can't go wrong with the food. While the paellas are fantastic, the small plates are just more fun. The smoked trout with Serrano bacon and lemon is delicious, and the grilled baby octopus with fried potatoes and the sherry vinaigrette is stellar. The grilled lamb skewers are to-die-for and the Serrano ham cups with avocado, goat cheese and basil with a beet vinaigrette is another can't-miss.\n\nDon't take my word for it, you better show up before I drink them dry of that sangria.",2008-08-26 02:30:36,5,5,3,genuine,0.2414361001317523,1,1,1,1,1.0,1,1
OlJ9vcVFB1iEKcZO-MS3cQ,EPXmgi37eWOVHbXdR0VUsQ,"I stayed here in August or September 2007 when I had to go to Tampa for some training.  \n\nDue to the proximity of this hotel to the Nielsen Company location on Brooker Creek, this place should just rename itself ""The Nielsen Dorm Facilities.""",2008-01-07 22:31:58,5,3,1,genuine,0.0,1,1,0,1,1.0,1,1
wAw9FHMiOZd9ROoc5x4DpQ,f92tbd7LlfA_fNTL6Jk-gQ,"I dig the feel of this place--  old school new york subway station meets  fancy southern restaurant.\n\nHowever, the meal didn't live up to the setting.  The oysters were outstanding, but the prepared dishes felt short (meh on the salad and the shrimp). Also, the service was painfully slow.",2011-04-23 22:59:40,3,1,1,fake,0.0818181818181818,0,0,0,1,1.0,1,1
kggqL33iZjeHmUn1Rtdjzg,52SwO8g2Zowd3vlvTHBU9A,Staff is very friendly.  Steak is tender.  I recommend the kabobs.  Friday & Saturday is a get there early night - Duh!,2010-09-20 22:14:26,4,1,1,genuine,0.0708333333333333,1,0,0,1,1.0,1,1
wrNOKq0hOlz8q1N_YCNXCA,lJhyhFgUyyjA1A0amw_IAw,"Ooka has been recommended to me by a few people at work as the best sushi in town (Willow Grove that is).\nUpon arrival, I was greeted with very pleasant, smiling faces of the hostesses and many of ""The Best"" and ""Top Pick"" certificates from various review centers (yes, Zagat, too).\nI have to say, the food was amazing and I really enjoyed it, but your restaurant experience is only as good as the wait staff.\nTo make a long story short, I never got my soup, even though I asked for it twice.\nThey brought the wrong food to my table at one point.\nI had a constant feeling that I'm not welcome and need to leave pronto.\nThey were cleaning out the plates in front of us the moment I lifted the last piece to eat it (not quite literally, but it felt that way). By the way, I appreciate when the waiter/waitress cleans up quickly, but there's 'quickly' and 'too quickly.'\nLastly, I really wanted to try their amazing-looking desserts, but I was never given the chance to pick anything, asked if that's all I would like to have that evening and the waitress just showed the check in front me and left.\nShortly after that, I was gone too.\n\nThere are many other Ooka locations and I'm sure I'll have a better overall experience there, so I'm not completely DONE with them as a chain - the food was really good and presented beautifully.\nHeck, I might even give this one another chance, just because I used to be a waiter too and know how some nights are just not meant for working :))",2010-02-20 15:49:27,3,0,0,genuine,0.287183908045977,1,0,1,1,1.0,1,1
wrNOKq0hOlz8q1N_YCNXCA,57xQeo2ryfRX29lIE5tn4A,"I went to Benihana at the Plymouth Meeting mall (right by AMC Theatres) on Christmas day. It was the only (besides the Chinese buffet) open restaurant, but they were not too packed. As soon as we sat down, the server was greeting us. From the moment we walked in, to the moment we walked out, the staff was smiling and giving us their full attention. The cook that prepared our meal was skilled and even tried to be funny (unsuccessfully :)), but overall, we had a great time. Between the three of us, we couldn't finish even the two main meals, after we had three appetizers.\n\nI will go back again. Soon.",2009-12-26 21:46:51,5,3,0,genuine,0.2074481074481074,1,1,0,1,1.0,1,1
4F0IjrUJGAieoWwHnRhIJw,6iqY6lCF3sz6XCpOKxAx_Q,"i know.  you're thinking ""4 stars??  for white castle??""\n\nallow me to explain.  \n\nthere is something about the combination of  steamed soggy bread and re-hydrated onions that is addictive.  especially when you find yourself living in a place where this specific flavor is nonexistent.  just as taco bell isn't mexican food - it's taco bell - so white castle isn't a burger and fries.  it's white castle.  it's my guilty pleasure to beat all guilty pleasures.  it is completely satisfying.",2008-01-30 04:24:02,4,1,3,genuine,-0.05,1,0,0,1,1.0,1,1
4F0IjrUJGAieoWwHnRhIJw,9dCuaeD4IfJnP-lQ4-yyVQ,three words:  chocolate chip pancakes.\n\n2 stars because crazy wait + no reservation option = me not coming here more often.,2008-01-30 00:46:25,2,1,1,fake,-0.0499999999999999,0,0,0,0,1.0,1,1
4ZaqBJqt7laPPs8xfWvr6A,W51u88bEHy3SpXIr6YXLcA,"Yummy cold brew coffee & friendly staff. However prices are on the steep side and there is no a/c. On a moderately warm day of 70, I was starting to sweat in the couple minutes it took to get my drinks I felt awful for the staff who have to stay in that sweatshop for hours. Management needs to stop being so cheap and actually turn on the a/c!",2017-05-28 06:06:53,3,1,0,fake,-0.0321428571428571,0,0,0,1,1.0,1,1
4ZaqBJqt7laPPs8xfWvr6A,ItxsqIVQi1wzfE8gRNqs6A,Topa Topa is a cool bar located in an old converted car garage. The space is very spacious with tons of tables and plenty seating around the bar. Delicious beers on tap which you can purchase by the pint or growler. Staff is friendly and accommodating. Food is also available for order in the hallway to the right. Stop in for a refreshing brew!,2017-09-10 22:31:07,5,1,1,genuine,0.4169642857142857,1,0,0,1,1.0,1,1
4ZaqBJqt7laPPs8xfWvr6A,iNJJ-A3RI9w3PrC9xWx-oA,The service was nice but the food can only be described as average and overpriced. I highly recommend sitting on the outdoor patio. We came with a large group so we got tucked into an unsightly back corner inside. The difference in decor and atmosphere is night and day. Decent place but nothing to write home about.,2015-06-04 01:14:43,3,0,0,fake,0.1415646258503401,0,0,0,1,1.0,1,1
zjPbmmvO4QzE_nE9uErLTg,-DgYDZGEDG1KbXIi0yWsNA,"We went on the bike/wine tour through the San Ynez Valley and it was really wonderful.  The trip was organized very well, the wineries we stopped at were fantastic, and the bike ride was pretty easy and relaxing and lots of fun.  The scenery is really wonderful and I can't think of a better way to see the valley then on a bike.  I highly recommend this trip! Only thing I would change is adding one more bike riding segment!",2011-08-03 16:54:53,5,4,1,genuine,0.4462121212121212,1,1,0,1,1.0,1,1
65uUyG9yuF0rdMh0z7ajaA,FO-Vrvb1zdE3PCFIfImm3Q,"5 stars for the food, the environment, and the thoughtful service.\n\nIt's a quaint country farmhouse converted to a wonderful, romantic restaurant, with tables spread throughout its many rooms, most of which have only a few tables providing an intimate, classic dining experience.\n\nThe food is uniformly fantastic, from the classic Caesar salad prepared tableside, to the big, rich Maryland crab cakes wholly comprised of fresh crab meat and plated across a pair of spicy and pesto sauces.  Lobster crepes (stuffed with equally massive amounts of lobster), truly rich lobster bisque, moist tender rack of lamb, and obscenely intense veal tenderloin with exotic mushroom sauce (a special) were equally brilliant examples.\nMy only observation and minor nit about the food was that the meat was not precisely cooked - all the smaller medium-rare items were solidly medium, while the larger filet mignon, ordered medium, came out medium-rare.  But all were delectable, and very tender.\n\nDesserts were equally brilliant, from the Belgian dark chocolate mousse to the Austrian cheese strudel.\n\nThe wine list is reasonably large and well selected, especially considering the location, though the markup is enormous.  Unfortunately, due to the exorbitant licensing fees charged by Pennsylvania, this is more or less unavoidable, and with a careful search (and sufficient knowledge) reasonable value items can be found.\n\nService was friendly, helpful, and knowledgeable (though the average wine knowledge of the servers isn't large).\n\nIf you're looking for a fantastic meal in an out-of-the-way, rusticly romantic environment, look no further.\n\nThey also have a B&B with quite reasonably priced rooms on site.",2007-10-22 02:13:55,5,4,0,genuine,0.1949546485260771,1,1,1,1,1.0,1,1
NIhcRW6DWvk1JQhDhXwgOQ,aOTLR_RS-2mjxwa1n_Cecw,"I've been having a hard time finding a good brunch spot, until I found Jones.  Unfortunately for me, Jones is a 3 hour drive.   So I will not be frequenting it - but one can dream.\n\nWe sat upstairs, which I recommend - a little quieter & you can watch everyone below you.  We were there around 11:30 on a rainy Saturday, and were sat immediately.  Service was fine, and fast.  Decor is super cute.\n\nI had the French toast with tater tots.  Tater tots, you ask?  Yes, because where I'm from, they are not quite ubiquitous.  My Philly friend (aka tour guide) also had the French toast, and my husband had the avocado sandwich with fries.   The French toast was thick and tasty, and probably the biggest piece of French toast I've ever seen.   I enjoyed the tater tots.  My husband liked his sandwich and fries, but the fries went cold fast.  \n\nPerhaps a second location in DC or Boston is needed?",2010-07-12 00:06:22,4,1,0,genuine,0.0629901960784313,1,0,1,1,1.0,1,1
NIhcRW6DWvk1JQhDhXwgOQ,_4lcKyUVMdpS8g0LKuThxA,"I don't always get drunk and go to clubs, but when I do, I like to make sure I'm on vacation in a different city and pay a cover.\n\nI remember mostly EDM with some hip-hop, a lot of dancing, and it being super crowded. Floor was sticky. Definitely a dressier crowd. I don't miss my club days.\n\nI had fun, but keep in mind, I was feeling the effects of alcohol. I'd probably not choose to go here sober, however, I didn't see many other dancing options in the immediate vicinity.",2015-10-05 16:34:39,3,7,11,fake,0.1608333333333333,0,1,0,1,1.0,1,1
NIhcRW6DWvk1JQhDhXwgOQ,zFv5g8GUwqjMR9hxo5DgIA,"My iced almond milk caramel latte was fine, as was my friend's cortado and bagel. Four stars for the overall atmosphere, decor, and service, but three for the coffee. I've had better, and I've had worse. I prefer a strong coffee/espresso flavor, and my latte was missing that. It was more milky than anything, so the overall balance was off. Pastries (not bagels) looked tasty, and if I did happen to stop in again, I'd grab one.",2015-09-09 16:40:14,3,2,1,fake,0.15625,0,0,0,1,1.0,1,1
NIhcRW6DWvk1JQhDhXwgOQ,5vYGcMkqsUcyfU29suMpSQ,"Muriel's is a fine dining gem. I had been wanting to visit and finally, on my last night in New Orleans, I did. I enjoyed the fantastic service and delicious food.\n\nI hadn't yet had a Hurricane and figured this would be the perfect place to get one. I definitely enjoyed it. The bread is addictively good and I couldn't stop eating it. I ordered my new standard--greens and redfish courtbouillon. I love redfish. Both the items were great. I loved the greens and the popcorn rice paired well with the redfish and sauce. I was too full for dessert, but I definitely want to return and will definitely be ordering dessert.\n\nIf you are looking for fine dining and excellent NOLA cuisine in the French Quarter, Muriel's is your spot.",2019-05-19 23:48:28,5,8,1,genuine,0.4503189792663477,1,1,0,1,1.0,1,1
NIhcRW6DWvk1JQhDhXwgOQ,p0-IYCLO0TIaPe10yBUJlw,This shop is fantastic. It's very welcoming and not gimmicky. I felt like the staff was really knowledgeable and helpful. You could tell they love talking about and teach about voodoo. My interaction was great--I told the super nice gentleman what I was going through and he recommended the perfect item. My Oya doll and I haven't been separated since. I really appreciate that he took the time to explain her protections and offer other suggestions as well. I'm looking forward to returning here on my next visit.,2019-05-02 10:15:47,5,8,2,genuine,0.3098484848484849,1,1,0,1,1.0,1,1
NIhcRW6DWvk1JQhDhXwgOQ,MJstm5i1AbXxVb16O8hIWw,"We all really enjoyed Pho Street. We didn't plan our visit, but were happy to have happened about this place. It's casual with plenty of seating and you can order at a kiosk, which is much appreciated.\n\nI did a quick scan of the reviews to know not to order the pho. I ordered the grilled pork vermicelli bowl (bun thit nuong with cha gio), my sister had the Vietnamese hoagie (banh mi thit nuong), and my brother-in-law ordered the broken rice (com tam) with a cha gio side. Everything was excellent. The pork was super flavorful and there were tons of fresh vegetables and herbs in my bun. My sister said the bread on her banh mi was great. And my BIL loved his perfectly cooked and delicious com tam. We all appreciated the crispness of the cha gio. Even my baby niece enjoyed the vegetables we gave her. I love that they have a house-made fish sauce, which add depth to everything.\n\nI'd stop here again if craving Vietnamese in Center City.",2019-12-08 16:19:07,4,9,4,genuine,0.4215686274509804,1,1,1,1,1.0,1,1
NIhcRW6DWvk1JQhDhXwgOQ,8Yh_gDyVKbMgS4xPIxtXCw,"Our iced caramel soy lattes were OK. Something was missing--perhaps a stronger coffee flavor? Their hot lattes may be better, as some places are better at hot lattes than cold ones.\n\nHowever, I did love the fun, eclectic vibe, and the food we saw looked delicious. I'd come back to try some noshes, keeping in mind that the line gets long and parking will take a few circles around the block.",2015-12-04 18:17:43,3,5,8,fake,0.2458333333333333,1,1,0,1,1.0,1,1
aF3mEXDJuILmeF-9PcxAsQ,GDVw4oWAbKSVyFfW9OcJVw,"I was expecting greasy, lackluster bar food here and was very pleasantly surprised to enjoy delicious, creative, gourmet food instead! My favorite dish was the smoked trout wontons, but really everything was pretty amazing. Loved the chocolate lava cake. I'll definitely make a point to come back here the next time I take the train to Philly.",2011-06-14 15:23:28,5,2,0,genuine,0.3645833333333333,1,0,0,1,1.0,1,1
baSDvZweZk6qLY_kHPvYzQ,ZVnIBmxexDfe-PtLyE129w,Beautiful place for a wedding. Parking right outside (first 75 minutes free) or park across the street in the parking structure (first 75 minutes free and $1.50 for every hour after).\nThere are many floors and hidden gems in this beautiful space. I attended a wedding in the Mural Room and it was stunning.  The judge who married my friends was stellar and even came around to say hello to the rows of attendees before the start.  They have a clock tower here and the history behind it is fascinating. You can also go to the very top and see a beautiful 360 view of Santa Barbara. Truly a great space for guests to entertain themselves and enjoy Santa Barbara. This is preservation and history at its finest.,2015-12-07 20:18:36,5,0,0,genuine,0.4010025062656641,1,0,0,1,1.0,1,1
XLs_PhrJ7Qwn_RfgMM7Djw,n1VdDN9pbgt2nk5ZZa9uZQ,"Decent quality. The Siu Mai does not look nor tastes like Siu Mai. The salad was drenched in dressing. The miso soup have a hint of bitter tasted but then I have very sensitive taste buds. I ordered the Chirachi bowl which lets me taste the quality of the fishes. Half of them tasted fresh. The other half was okay. So overall assessment... Eh... It's okay. Disclaimer: I'm use to the standards in NYC, and Los Angeles.",2013-07-21 01:36:51,3,0,0,fake,0.1038333333333333,0,0,0,1,1.0,1,1
rppTTi-kfF8-qyiArNemag,CkaEfjxUX32v3J_CKCHf6g,"I thought it would be a good idea to come by here for dinner the other night with the family. It was so busy and the wait was rather frustrating. Otherwise, service was friendly and decent if you are forgiving that things took longer to come (or not at all) since they're so busy (food, water, extra utensils....). They also kept running out of supplies (kids drink cups, soup to go containers)... better stock up! \n\nThe seating were great since there were booth and table seating. I had really wanted a highchair but gave it up for a booster seat when I found out that I was going to be put back on the waiting list. \n\nTheir strawberry lemonade was tasty and I asked them to keep it coming. Haha. I ended up with the Mahi Mahi tacos (came with 2) and the side of chips and I was content. I just wished it didn't take forever for us to have the meal.",2017-03-20 12:26:13,3,0,0,genuine,0.2108974358974359,0,0,1,1,1.0,1,1
rppTTi-kfF8-qyiArNemag,mAzhHctUlrUfZfxKJXdcFg,This Target was far off in the distance in this strip mall but it needed the space because of the size of the store! \n\nService was fairly friendly and most of the time the folks were more by the cashiers area. The aisles were clean for the most part and items on sale were displayed. \n\nMy favorite part is the $1 (or not $1 section) and of course who doesn't enjoy their Starbucks while browsing through the Target aisles.,2017-02-14 20:18:32,3,0,1,fake,0.4083333333333333,1,0,0,1,1.0,1,1
rppTTi-kfF8-qyiArNemag,3SOTPxVPNRp7c83XKDB6Yw,"Service was friendly and nice. However, they got my order wrong when I asked for a plain sandwich. \n\nThe bigger issue was the ants all over the drink area. That was a little disturbing. Also their water button doesn't work And that was all I was able to drink. \n\nA little disappointed.",2014-09-21 17:58:19,2,0,0,fake,-0.0864285714285714,0,0,0,1,1.0,1,1
rppTTi-kfF8-qyiArNemag,9T2Fo7uoR3dHLC3-sUSU2g,Friendly staffed and always packed whether it is at the counter or the drive-thru. So far the orders have been correct which is more I can say for some other locations. \n\nIt is connected to the gas station so you can walk right over if you need something. The ventilation isn't that great in there but if you can get in and out quick. There are great combinations and the usual list of Dunkin Donut favorites.,2012-04-19 02:38:55,3,0,2,fake,0.3132275132275132,1,0,0,1,1.0,1,1
rppTTi-kfF8-qyiArNemag,OBnR9CK8wuHX1NfezTsQZA,"I like this location and its usually tidy and clean which is why I enjoy coming here. \n\nThe cashiers are usually friendly especially the guy with the great animated voice. \n\nThey have everything you would probably need at these stores. everything for different holidays and greeting cards! Kitchenware, toiletries, food!",2015-05-24 04:11:38,4,0,0,genuine,0.3630952380952381,1,0,0,1,1.0,1,1
rppTTi-kfF8-qyiArNemag,ZU74D5OTiX4RN373LUde9Q,"LOVE it here! It's clean, bright and happy feeling, waterfalls, outdoor music, plants, trees, and did I mention clean? What more can I ask for? \n\nIt is set up like an outlet (the outdoors concept) but it a lot more pleasant feeling. You can walk around and enjoy yourself. Tired from shopping? Take a seat on the wooden benches or the rocking chairs. \n\nThey have high scale stores like Williams-Sonoma, teen stores like Hollister and Aeropostale, department stores such as Macys and JC Penny, and a few special boutiques. Barnes & Noble is one of the favorites.\n\nThere are many delicious looking restaurants with beautiful decors scattered around the mall. There is even a late nite ""club"" that I have yet to visit. They do have food shops such as Moe's Southwest Grill, Cosi, a Teriyaki shop, and a Crepe shop. \n\nLooking for an evening or holiday event? They got it. Just look out for the large banners when you pass by and make sure you pay attention to the details (time and date) since I show up at the wrong times/dates sometimes.",2010-10-05 23:36:35,4,3,1,genuine,0.3109238095238095,1,1,1,1,1.0,1,1
rppTTi-kfF8-qyiArNemag,UzcJ8p40Gn2i_mWLYmwkkQ,I've always liked Ker's Winghouse and this time it was no different. They opened in place of the Buffalo Wings that was suppose to open many moons ago and it's a great place. \n\nService is fantastic and attentive. The managers were great and friendly. Everyone was there for anything that you may need.  \n\nI always order my wings mild and naked and still love it. I like how their wings are mild and I get to add the amount of hot sauce that I would like especially if I am eating with people who do not like spices. Happy hour is great but beat the crowd! \n\nParking is a problem now but I hear that they will have expanded parking soon.,2013-07-29 02:30:31,4,1,0,genuine,0.417156862745098,1,0,0,1,1.0,1,1
rppTTi-kfF8-qyiArNemag,wxYPkWXyafelHuOl1MogVw,I don't come to this location much since it's not in my neighborhood but it's one of the ones that play some independent films that other do not.  \n\nI came here with some girlfriends the other night and enjoyed our time here.  Loving my large tub of popcorn and soda. A girl gotta splurge some time! The theaters were decently cleaned and the bathrooms weren't terrible even though it was the end of the night already. I was glad.,2017-02-06 03:48:46,3,1,0,fake,0.0984523809523809,0,0,0,1,1.0,1,1
rppTTi-kfF8-qyiArNemag,4dxK9U9N1EnEhGEVYyRTnw,"I've come here for the dim sum or some of the Cantonese dishes. The service is decent. \n\nHowever, some of the dim sum dishes aren't the way I remember it from NY or even close. There's been a few instances where I was sorely disappointed with the dishes. One time the sticky rice that just seemed undercooked. I was afraid to even have it. Sadly, I had given it more than a few tries and haven't been back since.",2014-07-27 18:12:46,2,1,0,fake,-0.1348484848484848,0,0,0,1,1.0,1,1
KYBEVBAP7QUlt1LjmatTJg,Tjmc1czu1ZgdtCawoWu6CA,i love the south. i love southern food. i love delicious pancakes.  i love amazing  country ham. i love sweet tea. i love having a big booth all to myself.  i love nice waitresses. i love people who stand up to greet someone they run into at a restaurant during breakfast. i love waitresses that offer to give me a refill of sweet tea for the road.  l love breakfasts that cost $8.\n\ni hate leaving pancake pantry.,2009-05-04 19:08:41,5,2,3,genuine,0.3944444444444444,1,0,0,1,1.0,1,1
QJI9OSEn6ujRCtrX06vs1w,x-ITmXFdVlQ9aRVPRZN8LQ,"Visiting Tampa for the second time, our colleagues here decided to take us out to Boizao.  I've never been to one of these Brazilian Steakhouses, but have heard a lot about them.  I knew that I was in for a lot of food.\n\nFood - The amount of meat that you eat here is ridiculous.  14 different types of meat is offered to you throughout the evening.  There is a cardboard circle in front of your seat that is red on one side and green on the other.  If you place the green side up, they will offer you a piece of meat....if you have the red side up, they will pass your table.  I had the green side up most of the evening. I think I sampled everything except one or two types of meat.  Here's what I tasted:\n\nFilet Mignon\nFilet Wrapped in Bacon\nLamb Chops\nLeg of Lamb\nPork Tenderloin\nRibs\nPrime Rib\nPicanha\nPicanha com alho (with Garlic)\nTop Sirloin\nBottom Sirloin\nBrazilian Pork Sausages\nChicken Legs marinated with beer\n\nYep....I pig'd out!  I passed on the salad bar though....as I knew I would have to save room in my stomach for all of this food.  I even had a little room for a Tiramisu for dessert.\n\nService - I thought the service was excellent.  There were 7 of us and we never had an empty glass of wine, water, or food.  The servers were very attentive and cordial.\n\nAtmosphere - The dining room is large and dark.  Nice setting for a dinner.  The tables are spaced appropriately....what I mean is that they aren't too close together.\n\nParking - There is valet parking that's available.\n\nSpecial Offers - I hear that kids under 7 eat FREE.  That's what my colleague who lives in Tampa tells me.  He says they come here once a month with his 5 kids.  That's a great deal.\n\nWill I return?  Only when I'm in the mood for massive amounts of meat....which is not too often.  That's not because I don't like the restaurant, it's because I don't eat meat that much.",2010-05-20 01:41:12,4,0,0,genuine,0.1104563492063492,1,0,1,1,1.0,1,1
QJI9OSEn6ujRCtrX06vs1w,YVRIf0MM7uGZyi2diP-RYA,"This place is a dump.  It's basically a gutted warehouse that looks like it was built in the 1960's and hasn't been updated since.  We came here for a gun show, which had very few vendors.  The parking is small and the entry to the expo center is weird....it's on the right side near the back of the building.\n\nIf I was a meeting planner, I wouldn't hold any meetings here unless it was for a swapmeet.\n\nReturn Factor - 1%",2013-01-01 15:40:27,2,6,1,genuine,-0.0373809523809523,0,1,0,1,1.0,1,1
